{
  "$schema": "https://json-schema.org/draft/2020-12/schema",
  "$id": "https://github.com/littlemex/tierbook/registry/schema.json",
  "title": "tier record",
  "description": "What one inference tier was measured to do. Contains no model name in any field the router reads: `serves` is provenance for a human, and every routing decision is taken from the measured fields. A field whose value was not measured is null, never zero and never a published figure -- this deployment has seen an engine advertise 7-14x more reusable cache than it had and a rate card price a model 17x wrong.",
  "type": "object",
  "required": [
    "adapter",
    "families",
    "id",
    "latency",
    "measured_at",
    "measurement_target",
    "price_card",
    "provenance",
    "reliability",
    "schema_version"
  ],
  "additionalProperties": false,
  "properties": {
    "schema_version": {
      "type": "integer",
      "const": 1,
      "description": "The record format. Present so a future reader can tell what it is looking at rather than guessing from which fields exist."
    },
    "id": {
      "type": "string",
      "description": "Stable key the router uses. Opaque; not parsed."
    },
    "serves": {
      "type": "object",
      "description": "Human-readable provenance only. The router must not branch on anything in here.",
      "properties": {
        "model": {
          "type": "string"
        },
        "endpoint": {
          "type": "string"
        },
        "deployment": {
          "type": "string"
        }
      }
    },
    "measured_at": {
      "type": "string",
      "format": "date"
    },
    "provenance": {
      "type": "object",
      "required": [
        "repo",
        "commit"
      ],
      "description": "Where the numbers came from, so a decision is reproducible from versioned inputs.",
      "properties": {
        "repo": {
          "type": "string"
        },
        "commit": {
          "type": "string"
        },
        "documents": {
          "type": "array",
          "items": {
            "type": "string"
          }
        }
      }
    },
    "adapter": {
      "type": "object",
      "required": [
        "wire",
        "tool_calling",
        "compliance"
      ],
      "description": "Protocol facts, measured separately from task ability. Conflating the two cost one tier 42% of its actions once.",
      "properties": {
        "wire": {
          "type": "string",
          "enum": [
            "chat_completions",
            "responses",
            "anthropic_messages"
          ]
        },
        "tool_calling": {
          "type": "string",
          "enum": [
            "native",
            "text_protocol",
            "none"
          ]
        },
        "compliance": {
          "type": "object",
          "description": "Fractions of parsed steps, from a measured run.",
          "properties": {
            "unusable_action_rate": {
              "type": [
                "number",
                "null"
              ]
            },
            "no_action_rate": {
              "type": [
                "number",
                "null"
              ]
            },
            "invented_tool_rate": {
              "type": [
                "number",
                "null"
              ]
            },
            "steps_observed": {
              "type": [
                "integer",
                "null"
              ]
            }
          }
        },
        "restrictions": {
          "type": "array",
          "description": "Combinations the endpoint refuses, as capability facts rather than as 400s discovered at runtime.",
          "items": {
            "type": "string"
          }
        }
      }
    },
    "price_card": {
      "type": "object",
      "required": [
        "unit",
        "source",
        "fresh_in",
        "output"
      ],
      "description": "Per request shape, because the cache discount attaches to the shape and not to the text: identical content sent as one long message hit 0% where a growing conversation hit 99.9%.",
      "properties": {
        "unit": {
          "type": "string",
          "const": "usd_per_mtok"
        },
        "source": {
          "type": "string",
          "description": "Catalog and retrieval, or the measurement that produced it. Published figures are inadmissible where a measured one exists."
        },
        "fresh_in": {
          "type": "number"
        },
        "cached_in": {
          "type": [
            "number",
            "null"
          ],
          "description": "null when the tier does not report cached tokens. Never coerced to zero: unmeasured is not free."
        },
        "output": {
          "type": "number"
        },
        "hourly_fixed_usd": {
          "type": [
            "number",
            "null"
          ],
          "description": "Non-null makes this tier's effective rate max(token rates, hourly / realised tasks per hour), recomputed hourly."
        },
        "cache_hit_rate_observed": {
          "type": [
            "number",
            "null"
          ]
        },
        "reusable_cache_tokens": {
          "type": [
            "integer",
            "null"
          ],
          "description": "Measured by interposing traffic between populate and reuse, not read from the engine's advertised capacity."
        }
      }
    },
    "latency": {
      "type": "object",
      "required": [
        "unit",
        "p50",
        "p95"
      ],
      "description": "A distribution, because chains stack tails and a mean hides the arrangement that misses its SLO. Superseded per family by `families[<family>].latency` where that exists, because latency turned out to be a property of the tier-and-family pair rather than of the tier.",
      "properties": {
        "unit": {
          "type": "string",
          "const": "seconds_per_task"
        },
        "p50": {
          "type": "number"
        },
        "mean": {
          "type": [
            "number",
            "null"
          ]
        },
        "p95": {
          "type": "number"
        },
        "max": {
          "type": [
            "number",
            "null"
          ]
        },
        "concurrency_when_measured": {
          "type": [
            "integer",
            "null"
          ],
          "description": "A latency figure taken at low concurrency is optimistic in exactly the regime where the cost figure is realistic."
        }
      }
    },
    "reliability": {
      "type": "object",
      "required": [
        "attempts_observed",
        "failures",
        "failure_classes"
      ],
      "description": "The term that reordered the arrangements. Cost of a call is bill + p/(1-p) * mean spend sunk before death, so an unreliable tier that dies late is dearer than its bill.",
      "properties": {
        "attempts_observed": {
          "type": "integer"
        },
        "failures": {
          "type": "integer"
        },
        "mean_sunk_usd": {
          "type": [
            "number",
            "null"
          ]
        },
        "failure_classes": {
          "type": "array",
          "items": {
            "type": "string"
          }
        }
      }
    },
    "families": {
      "type": "object",
      "description": "Per traffic family, the measured outcome and whether this tier is nested under the family's reference tier. Nesting is a per-family, per-pair property re-certified at admission, never a global assumption.",
      "additionalProperties": {
        "type": "object",
        "required": [
          "solved",
          "attempted",
          "suite"
        ],
        "properties": {
          "solved": {
            "type": "integer"
          },
          "attempted": {
            "type": "integer"
          },
          "suite": {
            "type": "string",
            "description": "The frozen benchmark set and its selection rule."
          },
          "runs_per_item": {
            "type": [
              "integer",
              "null"
            ],
            "description": "One run measures an episode, not a capability."
          },
          "nested_under_reference": {
            "type": [
              "boolean",
              "null"
            ]
          },
          "counterexamples": {
            "type": [
              "integer",
              "null"
            ],
            "description": "Items this tier solved and the reference did not, i.e. `paired_vs_reference.candidate_only`. Kept for readability. It is NOT a disqualification: a crossover is evidence that the reference is not sufficient for the family, not that the candidate is unsafe, and one crossover in twenty items is a coin flip. Nesting is used only to decide whether a chain may be constructed at all."
          },
          "bill_usd": {
            "type": [
              "number",
              "null"
            ]
          },
          "cohort": {
            "type": [
              "string",
              "null"
            ],
            "description": "Hash of the exact item set this outcome was measured on. Two records can only be compared as a pair if these match: without it there is no way to know the same items were given to both tiers, and a paired bound computed across different item sets is not a bound."
          },
          "paired_vs_reference": {
            "type": [
              "object",
              "null"
            ],
            "description": "The 2x2 against the family's reference tier on the same cohort. A paired experiment reported as two marginal rates throws away exactly the information that decides the comparison: 14 of 20 against 20 of 20 has a point difference of -0.30, but all six discordant pairs favour the reference and the lower bound is far below that.",
            "required": [
              "both",
              "candidate_only",
              "reference_only",
              "neither"
            ],
            "properties": {
              "both": {
                "type": "integer"
              },
              "candidate_only": {
                "type": "integer"
              },
              "reference_only": {
                "type": "integer"
              },
              "neither": {
                "type": "integer"
              }
            }
          },
          "accounting_boundary": {
            "type": [
              "string",
              "null"
            ],
            "description": "What `bill_usd` covers, so it is never added to a modelled surcharge for the same spend. Default meaning: the items that produced a usable episode, with attempts that died on transport excluded -- those are priced by `reliability.mean_sunk_usd` instead. One boundary, not both."
          },
          "latency": {
            "type": [
              "object",
              "null"
            ],
            "description": "Latency for this tier ON THIS FAMILY. The second family measured here made it clear that latency is a property of the pair and not of the tier: the same tier took 94 seconds a task on one family and 13 on another. A per-family figure supersedes the top-level one.",
            "properties": {
              "unit": {
                "type": "string"
              },
              "p50": {
                "type": "number"
              },
              "mean": {
                "type": [
                  "number",
                  "null"
                ]
              },
              "p95": {
                "type": [
                  "number",
                  "null"
                ]
              },
              "concurrency_when_measured": {
                "type": [
                  "integer",
                  "null"
                ]
              }
            }
          }
        }
      }
    },
    "eligibility": {
      "type": "object",
      "description": "Hard constraints, checked before any cost arithmetic.",
      "properties": {
        "context_tokens": {
          "type": [
            "integer",
            "null"
          ]
        },
        "modalities": {
          "type": "array",
          "items": {
            "type": "string"
          }
        },
        "residency": {
          "type": [
            "string",
            "null"
          ]
        },
        "notes": {
          "type": "array",
          "items": {
            "type": "string"
          }
        },
        "max_requests_per_second": {
          "type": [
            "number",
            "null"
          ],
          "description": "The cheapest tier can simply be unable to take the load. Null means unmeasured, which eligibility treats as unconstrained -- so measure it before assigning a family to a tier at volume."
        }
      }
    },
    "measurement_target": {
      "type": "object",
      "description": "Exactly what was measured, pinned. The rule stays model-agnostic; the record must not: a tier record that does not say what it measured silently describes a different system after the provider's next quiet upgrade.",
      "properties": {
        "endpoint": {
          "type": [
            "string",
            "null"
          ]
        },
        "served_model_version": {
          "type": [
            "string",
            "null"
          ]
        },
        "harness_commit": {
          "type": [
            "string",
            "null"
          ]
        },
        "serving_stack": {
          "type": [
            "string",
            "null"
          ]
        }
      }
    }
  }
}
